{"loaded_guides":["agent-behavior","developing-with-streamlit","aria_nbv/AGENTS.md","aria_nbv/aria_nbv/app/AGENTS.md"],"selected_skill":"agent-behavior + developing-with-streamlit","opened_references":["aria_nbv/aria_nbv/streamlit_app.py","aria_nbv/aria_nbv/app/config.py","aria_nbv/aria_nbv/app/app.py","aria_nbv/aria_nbv/utils/base_config.py","aria_nbv/tests/test_streamlit_entry.py","aria_nbv/tests/app/test_app_router.py","aria_nbv/aria_nbv/app/README.md"],"tool_calls":["memory search for Streamlit ownership","Streamlit reference discovery (blocked: Streamlit not installed)","rg repository owner search","AST parse of streamlit_app.main","git status --porcelain","git diff --check","focused pytest attempt (blocked: read-only uv cache)"],"exact_owner":"aria_nbv/aria_nbv/streamlit_app.py owns the import-light CLI/file-watcher boundary; aria_nbv/aria_nbv/app/config.py owns configured target resolution; aria_nbv/aria_nbv/app/app.py::NbvStreamlitApp.run owns the constructed application’s runtime/render lifetime.","handoff":null,"selected_verification":"Static AST proof confirms main() imports NbvStreamlitAppConfig and executes NbvStreamlitAppConfig().setup_target().run(). Repository status is clean and git diff --check is clean. The prescribed focused pytest target could not start because uv cannot create its cache temporary file on the read-only filesystem; Streamlit is also unavailable to the discovery environment.","outcome":"Decision: the CLI entrypoint constructs the configured application through NbvStreamlitAppConfig().setup_target(), then hands lifetime ownership to NbvStreamlitApp.run(). streamlit_app.py owns dispatch and watcher argument handling, not page/application lifetime. No checkout mutations were made."}