{"loaded_guides":["agent-behavior","aria_nbv/AGENTS.md","aria_nbv/aria_nbv/app/AGENTS.md","developing-with-streamlit"],"selected_skill":"agent-behavior","opened_references":["aria_nbv/aria_nbv/app/panels/counterfactual_rollouts.py:754-764,1071-1075,1873-1878","aria_nbv/aria_nbv/app/panels/common.py:12,46-52","aria_nbv/tests/app/panels/test_counterfactual_rollouts_panel.py:1194-1207"],"tool_calls":["rg exact definitions and consumers","git diff --quiet","git status --porcelain=v1","uv run pytest -q tests/app/panels/test_counterfactual_rollouts_panel.py"],"exact_owner":"aria_nbv/aria_nbv/app/panels/counterfactual_rollouts.py","handoff":null,"selected_verification":"Existing focused panel tests are the bounded proof; execution was blocked because the environment lacks pytest. Static consumer search and clean-worktree checks passed.","outcome":"Scoped decision: place the helper privately in counterfactual_rollouts.py, beside its existing panel-only formatters. Do not place it in panels/common.py: _pretty_label has demonstrated cross-panel consumers, while the requested helper has only one consumer. No checkout mutation occurred; git status is clean. "}