{"loaded_guides":[".agents/skills/agent-behavior/SKILL.md","aria_nbv/aria_nbv/app/AGENTS.md","aria_nbv/aria_nbv/rollouts/AGENTS.md","/home/jd/.agents/skills/developing-with-streamlit/SKILL.md"],"selected_skill":"agent-behavior + developing-with-streamlit","opened_references":["aria_nbv/aria_nbv/app/panels/_stored_rollouts_page.py","aria_nbv/aria_nbv/rollouts/inspection.py","aria_nbv/tests/app/panels/test_stored_rollouts_projection_laziness.py"],"tool_calls":["Streamlit discovery: blocked because Streamlit is not installed","Repository scan for exact owners and rollout stores","Focused pytest attempt: blocked because pytest is unavailable","git status --porcelain=v1"],"exact_owner":"aria_nbv/aria_nbv/app/panels/_stored_rollouts_page.py renders the inventory and validation status; aria_nbv/aria_nbv/rollouts/inspection.py owns discovery and inventory rows.","handoff":null,"selected_verification":"Bounded source inspection; live test execution unavailable in this read-only environment.","outcome":"The scoped decision is operational reporting only: count inventory rows with validation_ok == False and show each store’s path/name, schema status, validation errors, manifest path/version/profile/config, and timestamps. The current checkout contains 0 discovered rollout stores and therefore 0 invalid rollout stores; this is an empty local inventory, not a scientific metric. Invalid stores are explicitly marked BLOCKED and scientific projections are withheld. The checkout remained clean."}