{"loaded_guides":["agent-behavior","aria_nbv/AGENTS.md","aria_nbv/aria_nbv/rri_metrics/AGENTS.md"],"selected_skill":"agent-behavior","opened_references":["aria_nbv/aria_nbv/rri_metrics/README.md","aria_nbv/aria_nbv/rri_metrics/returns.py","aria_nbv/aria_nbv/oracle/scene_rri.py","aria_nbv/aria_nbv/oracle/target_rri.py"],"tool_calls":["git grep bounded call-site proof","git diff --check","git status --porcelain"],"exact_owner":"aria_nbv.rri_metrics.returns.root_normalized_gain","handoff":null,"selected_verification":"Static call-site proof passed; no matching helper exists under aria_nbv/aria_nbv/utils; git diff --check passed and checkout is clean.","outcome":"The lowest demonstrated shared domain owner is aria_nbv.rri_metrics.returns. root_normalized_gain is called by scene-level scoring at scene_rri.py:100 and Oracle target scoring at target_rri.py:293,341. The RRI README explicitly assigns gain kernels to rri_metrics.returns. A generic utils owner is rejected."}