{"loaded_guides":["AGENTS.md","aria_nbv/AGENTS.md","aria_nbv/aria_nbv/rri_metrics/AGENTS.md","aria_nbv/aria_nbv/oracle/README.md"],"selected_skill":"agent-behavior","opened_references":["aria_nbv/aria_nbv/oracle/_scoring.py","aria_nbv/aria_nbv/oracle/scene_rri.py","aria_nbv/aria_nbv/oracle/target_rri.py","aria_nbv/tests/oracle/test_scoring.py","aria_nbv/tests/oracle/test_scene_rri.py"],"tool_calls":["rg","sed","nl","git status","uv run pytest"],"exact_owner":"aria_nbv/aria_nbv/oracle/_scoring.py","handoff":null,"selected_verification":"Static import/call-site proof completed; focused pytest attempted but unavailable because pytest is not installed in the checkout environment.","outcome":"Decision: route the shared helper contract to oracle._scoring.py, not a generic utils bucket. Repository evidence: oracle/README.md explicitly assigns _CandidateRriScoringEngine and _root_error_tensor to oracle._scoring; both scene_rri.py and target_rri.py import and use them. The bounded test command could not start (uv: pytest not found). Checkout remains clean: git status shows only ## master."}