{"loaded_guides":["agent-behavior","graphify","aria-nbv-context/graphify-aria-boundary.md"],"selected_skill":"graphify","opened_references":[".agents/skills/README.md","Makefile:250-251",".agents/skills/aria-nbv-context/references/graphify-aria-boundary.md#accepted-bundle-manifest"],"tool_calls":["Read-only repository search and Git tree/blob verification"],"exact_owner":".agents/skills/aria-nbv-context/references/graphify-aria-boundary.md#accepted-bundle-manifest","handoff":"Refresh command: graphifyy==0.9.48, then graphify install --project --platform agents from the repository root. Not executed because it mutates the vendored bundle.","selected_verification":"Bounded Git proof: local tree 6943c772de908bdac1dc0d1b7f73fa7ed285433a; SKILL.md blob af3f723c7878b8ca9252af511270511002086ed4; 10 tracked files; worktree and bundle diff clean. Canonical full proof: make graphify-skill-upstream-self-test.","outcome":"The single provenance manifest is .agents/skills/aria-nbv-context/references/graphify-aria-boundary.md#accepted-bundle-manifest. It pins Graphify ref b2cd36267456c166788c95be6e68574064a92a42, the local bundle .agents/skills/graphify/, and the exact refresh and integrity commands above. No checkout bytes were changed."}