{"loaded_guides":["AGENTS.md","aria_nbv/AGENTS.md","docs/AGENTS.md",".agents/skills/agent-behavior/SKILL.md"],"selected_skill":"agent-behavior","opened_references":["aria_nbv/aria_nbv/rri_metrics/rri.py","aria_nbv/aria_nbv/oracle/target_rri.py","aria_nbv/tests/rri_metrics/test_rri.py","aria_nbv/tests/rollouts/test_counterfactuals.py","docs/typst/thesis/sections/03-oracle-and-data-generation/03-02-target-task-and-rri-labels.typ","docs/typst/shared/equations.typ","docs/typst/shared/equations/rl.typ","Makefile"],"tool_calls":["rg/sed owner tracing","git status --short","focused pytest attempt (blocked: pytest unavailable)"],"exact_owner":"Executable metric owner: aria_nbv/aria_nbv/rri_metrics/rri.py::compute_rri. Target-rollout integration owner: aria_nbv/aria_nbv/oracle/target_rri.py::TargetRriScorer._score. Active thesis prose owner: docs/typst/thesis/sections/03-oracle-and-data-generation/03-02-target-task-and-rri-labels.typ. Canonical notation owners: docs/typst/shared/equations.typ and docs/typst/shared/equations/rl.typ; generated notation is derived.","handoff":null,"selected_verification":"cd aria_nbv && uv run pytest --import-mode=importlib tests/rri_metrics/test_rri.py::test_compute_rri_returns_directional_diagnostics tests/rollouts/test_counterfactuals.py::test_target_scorer_computes_target_and_scene_rri_from_one_pointcloud_batch; then make thesis-pdf-ci and make typst-authoring-contract. If notation changes, run make glossary first.","outcome":"Scoped decision: keep state-relative one-step diagnostic semantics synchronized with compute_rri, TargetRriScorer integration, thesis section 03-02, and shared equation sources; do not conflate it with root-normalized training reward. The focused test was blocked because pytest is not installed or executable in this checkout. No files were modified; git status was clean. "}