{"loaded_guides":["agent-behavior","aria-nbv-context","developing-with-streamlit"],"selected_skill":"developing-with-streamlit","opened_references":["aria_nbv/AGENTS.md","aria_nbv/aria_nbv/app/AGENTS.md","aria_nbv/aria_nbv/rollouts/AGENTS.md","aria_nbv/aria_nbv/rollouts/inspection.py","aria_nbv/tests/rollouts/test_inspection.py"],"tool_calls":["repository inspection with rg/sed","uv run pytest tests/rollouts/test_inspection.py -k rollout_store_inventory_rows -q","git status --porcelain=v1"],"exact_owner":"aria_nbv/aria_nbv/rollouts/inspection.py::rollout_store_inventory_rows; Streamlit consumer: aria_nbv/aria_nbv/app/panels/_stored_rollouts_page.py::_cached_inventory","handoff":null,"selected_verification":"The focused inventory test is the bounded proof, but execution was blocked because uv could not create a temporary file on the read-only filesystem. Streamlit reference discovery also confirmed no installed Streamlit environment. Checkout remained clean.","outcome":"Invalid-store count: 2 of 3. /runs/a is valid. Supplied provenance: /runs/b failed schema v8; first error: missing actor_action_mask. /runs/c failed schema v9; first error: malformed manifest. This is an operational inventory count and provenance report, not a scientific metric."}