{"loaded_guides":["agent-behavior","aria-nbv-context"],"selected_skill":"agent-behavior → aria-nbv-context","opened_references":[".agents/skills/agent-behavior/references/reviewed-intent.md",".omx/specs/deep-interview-aria-nbv-agent-scaffold-target-state.md","docs/AGENTS.md","docs/typst/shared/style.typ",".agents/skills/typst-authoring/SKILL.md"],"tool_calls":["bounded rg owner search","exact source inspection","git status","Typst compile of docs/typst/shared/style.typ"],"exact_owner":".omx/specs/deep-interview-aria-nbv-agent-scaffold-target-state.md owns the accepted scoped requirement; docs/typst/shared/style.typ owns the thesis-to-code link contract and implementation; docs/AGENTS.md provides the route","handoff":null,"selected_verification":"typst compile --format pdf docs/typst/shared/style.typ /dev/null; checkout remained clean (master). Full thesis compile was not admissible because this snapshot lacks docs/typst/thesis/main.typ and draft_markers.typ.","outcome":"The near miss must stop without a proposal: the accepted specification already fixes the decision—final links use gh, draft links use gh-wip/gh-symbol, submission disables draft links, and source-link changes belong in a separate thesis PR rather than scaffold work. The exact owner and implementation agree. General human intent was not loaded as a deciding source. No files were mutated."}