{"loaded_guides":["agent-behavior","aria-nbv-context"],"selected_skill":"agent-behavior","opened_references":["aria_nbv/aria_nbv/app/AGENTS.md","aria_nbv/aria_nbv/app/state_types.py","aria_nbv/aria_nbv/app/state.py","aria_nbv/aria_nbv/app/controller.py","aria_nbv/aria_nbv/app/panels/vin_diagnostics.py","aria_nbv/tests/test_app_state_signature.py"],"tool_calls":["rg -n config_signature consumers/guides","git status --short","uv run pytest -q aria_nbv/tests/test_app_state_signature.py","nl -ba exact owner/consumer lines"],"exact_owner":"aria_nbv/aria_nbv/app/state_types.py:57-64 (`config_signature`)","handoff":"No implementation handoff: the requested placement is already present. `app/state.py` is only the Streamlit adapter/re-export and is not the shared behavioral owner.","selected_verification":"Bounded static proof passed by exact-source inspection: `controller.py:18-25` and `panels/vin_diagnostics.py:20-21` import `config_signature` directly from `.state_types`; both contain call sites. Targeted pytest could not run because `pytest` is unavailable, and the checkout has no Python executable. `git status --short` remained clean.","outcome":"Decision: keep `config_signature` at `aria_nbv/aria_nbv/app/state_types.py`, the lowest shared Streamlit-free app owner for the app controller and VIN diagnostics panel. No checkout mutation occurred."}