{"loaded_guides":["agent-behavior"],"selected_skill":"agent-behavior","opened_references":["aria_nbv/AGENTS.md","aria_nbv/aria_nbv/utils/base_config.py","aria_nbv/tests/test_base_config_toml.py"],"tool_calls":["rg exact contract and owners","git status","uv run pytest blocked: read-only filesystem","python3 pytest unavailable","AST/source assertion proof"],"exact_owner":"Production: aria_nbv/aria_nbv/utils/base_config.py. Fixed fixture: aria_nbv/tests/test_base_config_toml.py (_FactoryTargetConfig -> _FactoryTarget.setup_target).","handoff":null,"selected_verification":"Read-only AST/source assertions passed; git status remained clean. Pytest was unavailable because uv and pytest required unavailable filesystem/dependency writes.","outcome":"`defer proposal-fixture-config-factory` is the typed transition `active -> deferred` as a disposition, while the contract remains active and implemented. Deferral records that evaluation or follow-up is postponed; it does not remove, disable, or edit the config-factory behavior. The exact fixture still proves typed delegation from `_FactoryTargetConfig.setup_target()` to `_FactoryTarget.setup_target()`. Checkout left clean."}