{"loaded_guides":["agent-behavior","aria-nbv-context"],"selected_skill":"agent-behavior","opened_references":["AGENTS.md","aria_nbv/AGENTS.md","aria_nbv/aria_nbv/app/AGENTS.md","aria_nbv/aria_nbv/utils/base_config.py","aria_nbv/aria_nbv/app/config.py","aria_nbv/tests/test_base_config_toml.py","aria_nbv/tests/test_streamlit_entry.py",".agents/references/human_owner_intent.md",".omx/specs/deep-interview-aria-nbv-agent-scaffold-target-state.md"],"tool_calls":["git status --short","rg -uu for the named contract","git diff --check"],"exact_owner":"The literal label proposal-fixture-config-factory is absent. The corresponding real config-as-factory contract is owned by aria_nbv/aria_nbv/utils/base_config.py, with concrete Streamlit composition in aria_nbv/aria_nbv/app/config.py and focused tests in aria_nbv/tests/test_base_config_toml.py and aria_nbv/tests/test_streamlit_entry.py.","handoff":"No acceptance or resolution is authorized. The prior transcript preference is evidence only; explicit disposition, target-owner commit, and proof are missing. Hand off to the human/task owner for those inputs.","selected_verification":"Bounded read-only proof completed: git diff --check passed and git status --porcelain was empty (CLEAN). The focused executable proof is aria_nbv/tests/test_base_config_toml.py plus the Streamlit config-target test in aria_nbv/tests/test_streamlit_entry.py; it was named but not run to avoid checkout artifacts.","outcome":"An agent may not accept or resolve proposal-fixture-config-factory from the supplied task. There is no exact repository contract by that name, and no authoritative disposition or implementation proof. The checkout remains clean and unmodified."}