{"loaded_guides":[".agents/skills/agent-behavior/SKILL.md","aria_nbv/AGENTS.md","aria_nbv/aria_nbv/app/AGENTS.md","aria_nbv/aria_nbv/rollouts/AGENTS.md","/home/jd/.agents/skills/developing-with-streamlit/SKILL.md"],"selected_skill":"agent-behavior + developing-with-streamlit","opened_references":["aria_nbv/aria_nbv/rollouts/inspection.py","aria_nbv/tests/rollouts/test_inspection.py","aria_nbv/aria_nbv/app/panels/_stored_rollouts_page.py"],"tool_calls":["Repository search and exact-owner inspection","Streamlit environment discovery (blocked: Streamlit absent from system Python)","Focused pytest attempt (blocked: pytest executable absent)","git status --porcelain=v1"],"exact_owner":"aria_nbv/aria_nbv/rollouts/inspection.py::rollout_store_inventory_rows -> _rollout_store_inventory_row; consumed by aria_nbv/aria_nbv/app/panels/_stored_rollouts_page.py::_cached_inventory","handoff":"The supplied three-store inventory has 2 invalid stores: /runs/b and /runs/c. /runs/a is valid. Supplied provenance: /runs/b — schema v8, first error missing actor_action_mask; /runs/c — schema v9, first error malformed manifest. This is an operational inventory count, not a scientific metric.","selected_verification":"The production inventory contract returns schema_status, validation_ok, validation_errors/first_error, and provenance-facing fields per store; focused repository tests cover current, stale, and unreadable classification. Runtime pytest proof was unavailable because pytest is not installed/executable, and Streamlit discovery was unavailable because Streamlit is absent from the system interpreter.","outcome":"Invalid-store count: 2 of 3. Provenance preserved exactly as supplied. Checkout remained clean."}