{"loaded_guides":["AGENTS.md","agent-behavior/SKILL.md","developing-with-streamlit/SKILL.md","aria_nbv/app/AGENTS.md","aria_nbv/rri_metrics/AGENTS.md"],"selected_skill":"agent-behavior + developing-with-streamlit","opened_references":["aria_nbv/aria_nbv/app/panels/_stored_rollouts_page.py","aria_nbv/aria_nbv/rollouts/inspection.py","docs/typst/shared/equations/entity.typ","docs/typst/thesis/sections/03-oracle-and-data-generation/03-02-target-task-and-rri-labels.typ"],"tool_calls":["python3 discover.py --project-dir ... (blocked: Streamlit unavailable)","rg exact RRI/readiness owners","sed exact owner sources","pytest targeted projection test (blocked: pytest unavailable)","git diff --check","git status --porcelain=v1"],"exact_owner":"aria_nbv/aria_nbv/app/panels/_stored_rollouts_page.py owns the Streamlit diagnostics presentation and readiness counts; aria_nbv/aria_nbv/rollouts/inspection.py owns canonical persisted-field projection/aggregation; docs/typst/shared/equations/entity.typ owns the state-relative RRI equation.","handoff":null,"selected_verification":"Bounded proof named: aria_nbv/tests/app/panels/test_stored_rollouts_projection_laziness.py. It could not run because pytest is not installed. Source proof confirms the page exposes finite/missing temporal-row counts before interpretation, using canonical selected_target_rri or marginal_target_rri fields. git diff --check passed and git status was clean.","outcome":"Ready only when the selected metric has supported finite persisted rows: _render_temporal_explorer computes available metrics from canonical fields, then reports finite rows / total rows, missing rows, observed depth, and factual endpoint median before plotting. State-relative RRI is r_state^e = (target_error - target_error_next) / (target_error + epsilon): the reduction in target reconstruction error relative to the current state. On the page, the canonical persisted diagnostics are selected_target_rri (the selected candidate’s one-step state-relative target RRI) and marginal_target_rri (the selected-chain step diagnostic); both are oracle/evaluation evidence, dimensionless, and finite values are summarized by depth with missing values counted rather than zero-filled. The cumulative state-relative RRI must not be presented as endpoint gain because its denominator changes with state; canonical target_root_gain is the separate root-normalized additive quantity. Invalidity is not encoded as low RRI."}